{
  "work_id": "golden-time",
  "count": 11,
  "characters": [
    {
      "id": "kouko-kaga",
      "name": "Kouko Kaga",
      "alt_names": [
        "加賀香子"
      ],
      "role": "protagonist",
      "description": "She had a perfect future planned with Mitsuo Yanagisawa as her husband, and nothing will get in her way!   She has a side of her that is not violent as Mitsuo has described.",
      "metadata": {
        "gender": "female",
        "age": "18-19",
        "dateOfBirth": null
      },
      "images": [
        {
          "url": "https://s4.anilist.co/file/anilistcdn/character/large/b43669-D3Hw9vLHCVad.png",
          "type": "portrait",
          "source": "AniList"
        }
      ],
      "external_ids": {
        "anilist": 43669
      },
      "rarity": "legendary"
    },
    {
      "id": "banri-tada",
      "name": "Banri Tada",
      "alt_names": [
        "多田万里"
      ],
      "role": "protagonist",
      "description": "Having had an nearly fatal accident shortly after high school graduation, he has lost all memories from before then.  He spent a year recovering, and has now entered Law School.",
      "metadata": {
        "gender": "male",
        "age": "19",
        "dateOfBirth": null
      },
      "images": [
        {
          "url": "https://s4.anilist.co/file/anilistcdn/character/large/b43670-9CcqgGGV14Kv.png",
          "type": "portrait",
          "source": "AniList"
        }
      ],
      "external_ids": {
        "anilist": 43670
      },
      "rarity": "legendary"
    },
    {
      "id": "mitsuo-yanagisawa",
      "name": "Mitsuo Yanagisawa",
      "alt_names": [
        "柳澤光央"
      ],
      "role": "protagonist",
      "description": "__Height:__ 177 cm (5'10\")\n\nHe tried to escape from Kouko by secretly taking the entrance exams for a private law school in Tokyo. Just when he thought he was free of her at long last, she appeared out of nowhere, having found him out and secretly followed him to the same school.",
      "metadata": {
        "age": "18-19",
        "dateOfBirth": null
      },
      "images": [
        {
          "url": "https://s4.anilist.co/file/anilistcdn/character/large/43671.jpg",
          "type": "portrait",
          "source": "AniList"
        }
      ],
      "external_ids": {
        "anilist": 43671
      },
      "rarity": "legendary"
    },
    {
      "id": "nana-hayashida",
      "name": "Nana Hayashida",
      "alt_names": [
        "林田奈々",
        "Linda"
      ],
      "role": "protagonist",
      "description": "A second year student and Banri and Kouko's senior in the Festival Research Society.  Her nickname Linda (りんだ) is an alternate reading of the kanji for Hayashida (林田).   \n\n~!Banri's love interest and best-friend during High School, she now follows him and keeps an eye out for him, though he cannot remember her at all. For reasons unknown as yet, she has not told him about their shared past.!~",
      "metadata": {
        "gender": "female",
        "dateOfBirth": null
      },
      "images": [
        {
          "url": "https://s4.anilist.co/file/anilistcdn/character/large/43672.jpg",
          "type": "portrait",
          "source": "AniList"
        }
      ],
      "external_ids": {
        "anilist": 43672
      },
      "rarity": "legendary"
    },
    {
      "id": "chinami-oka",
      "name": "Chinami Oka",
      "alt_names": [
        "岡千波"
      ],
      "role": "protagonist",
      "description": "A rather petite girl specializing in film studies, she plays the role of young girls as a voice actor.",
      "metadata": {
        "gender": "female",
        "dateOfBirth": null
      },
      "images": [
        {
          "url": "https://s4.anilist.co/file/anilistcdn/character/large/56931.jpg",
          "type": "portrait",
          "source": "AniList"
        }
      ],
      "external_ids": {
        "anilist": 56931
      },
      "rarity": "legendary"
    },
    {
      "id": "takaya-satou",
      "name": "Takaya Satou",
      "alt_names": [
        "佐藤隆哉",
        "2D-kun",
        "Mr. Two Dimensions",
        "Satoutaka"
      ],
      "role": "supporting",
      "description": "__Height:__ 162cm (5'3\")\n\nFirst year law student. Totally fascinated by two-dimensional girls, he is awkward around three-dimensional (aka real) girls. He has gone so far as to invent his own ideal girl, a two-dimensional creation of his imagination known to him as VJ (Brigitte Jeomillia).",
      "metadata": {
        "gender": "male",
        "age": "18-19",
        "dateOfBirth": null
      },
      "images": [
        {
          "url": "https://s4.anilist.co/file/anilistcdn/character/large/73497.jpg",
          "type": "portrait",
          "source": "AniList"
        }
      ],
      "external_ids": {
        "anilist": 73497
      },
      "rarity": "rare"
    },
    {
      "id": "nana",
      "name": "Nana",
      "alt_names": [
        "Nana"
      ],
      "role": "supporting",
      "description": "Nana is a third-year female student. She dresses and acts similarly to the character of the same name in the manga \"Nana\".",
      "metadata": {
        "dateOfBirth": null
      },
      "images": [
        {
          "url": "https://s4.anilist.co/file/anilistcdn/character/large/87748.jpg",
          "type": "portrait",
          "source": "AniList"
        }
      ],
      "external_ids": {
        "anilist": 87748
      },
      "rarity": "rare"
    },
    {
      "id": "kosshii",
      "name": "Kosshii",
      "alt_names": [
        "コッシー"
      ],
      "role": "supporting",
      "description": "",
      "metadata": {
        "dateOfBirth": null
      },
      "images": [
        {
          "url": "https://s4.anilist.co/file/anilistcdn/character/large/87749.jpg",
          "type": "portrait",
          "source": "AniList"
        }
      ],
      "external_ids": {
        "anilist": 87749
      },
      "rarity": "rare"
    },
    {
      "id": "sao",
      "name": "Sao",
      "alt_names": [
        "さお"
      ],
      "role": "supporting",
      "description": "A member of Tea Club.",
      "metadata": {
        "dateOfBirth": null
      },
      "images": [
        {
          "url": "https://s4.anilist.co/file/anilistcdn/character/large/87750.jpg",
          "type": "portrait",
          "source": "AniList"
        }
      ],
      "external_ids": {
        "anilist": 87750
      },
      "rarity": "rare"
    },
    {
      "id": "shii",
      "name": "Shii",
      "alt_names": [
        "しー"
      ],
      "role": "supporting",
      "description": "A member of the Tea Club.",
      "metadata": {
        "dateOfBirth": null
      },
      "images": [
        {
          "url": "https://s4.anilist.co/file/anilistcdn/character/large/87751.jpg",
          "type": "portrait",
          "source": "AniList"
        }
      ],
      "external_ids": {
        "anilist": 87751
      },
      "rarity": "rare"
    },
    {
      "id": "banri-no-haha",
      "name": "Banri no Haha",
      "alt_names": [
        "万里の母"
      ],
      "role": "supporting",
      "description": "Tada Banri's mother.",
      "metadata": {
        "gender": "female",
        "dateOfBirth": null
      },
      "images": [
        {
          "url": "https://s4.anilist.co/file/anilistcdn/character/large/87752.jpg",
          "type": "portrait",
          "source": "AniList"
        }
      ],
      "external_ids": {
        "anilist": 87752
      },
      "rarity": "rare"
    }
  ],
  "updated_at": "2025-12-24T05:47:44.063Z"
}