{
  "work_id": "god-of-war-2",
  "count": 13,
  "characters": [
    {
      "id": "cory-barlog-2177",
      "name": "Cory Barlog",
      "alt_names": [],
      "role": "other",
      "description": "writer, director, designer",
      "metadata": {
        "positions": []
      },
      "images": [],
      "external_ids": {
        "rawg": 2177
      },
      "tags": [],
      "updated_at": "2025-12-23T15:15:57.016Z"
    },
    {
      "id": "bear-mccreary-1459",
      "name": "Bear McCreary",
      "alt_names": [],
      "role": "other",
      "description": "composer",
      "metadata": {
        "positions": []
      },
      "images": [],
      "external_ids": {
        "rawg": 1459
      },
      "tags": [],
      "updated_at": "2025-12-23T15:15:57.016Z"
    },
    {
      "id": "richard-zangrande-gaubert-2179",
      "name": "Richard Zangrande Gaubert",
      "alt_names": [],
      "role": "other",
      "description": "writer, designer",
      "metadata": {
        "positions": []
      },
      "images": [],
      "external_ids": {
        "rawg": 2179
      },
      "tags": [],
      "updated_at": "2025-12-23T15:15:57.016Z"
    },
    {
      "id": "matt-sophos-2336",
      "name": "Matt Sophos",
      "alt_names": [],
      "role": "other",
      "description": "writer, director",
      "metadata": {
        "positions": []
      },
      "images": [],
      "external_ids": {
        "rawg": 2336
      },
      "tags": [],
      "updated_at": "2025-12-23T15:15:57.016Z"
    },
    {
      "id": "matthew-sophos-2178",
      "name": "Matthew Sophos",
      "alt_names": [],
      "role": "other",
      "description": "writer",
      "metadata": {
        "positions": []
      },
      "images": [],
      "external_ids": {
        "rawg": 2178
      },
      "tags": [],
      "updated_at": "2025-12-23T15:15:57.016Z"
    },
    {
      "id": "richard-zangrande-gaubert-28779",
      "name": "Richard Zangrande Gaubert",
      "alt_names": [],
      "role": "other",
      "description": "writer",
      "metadata": {
        "positions": []
      },
      "images": [],
      "external_ids": {
        "rawg": 28779
      },
      "tags": [],
      "updated_at": "2025-12-23T15:15:57.016Z"
    },
    {
      "id": "chad-cox-28784",
      "name": "Chad Cox",
      "alt_names": [],
      "role": "other",
      "description": "producer",
      "metadata": {
        "positions": []
      },
      "images": [],
      "external_ids": {
        "rawg": 28784
      },
      "tags": [],
      "updated_at": "2025-12-23T15:15:57.016Z"
    },
    {
      "id": "yumi-yang-28781",
      "name": "Yumi Yang",
      "alt_names": [],
      "role": "other",
      "description": "producer",
      "metadata": {
        "positions": []
      },
      "images": [],
      "external_ids": {
        "rawg": 28781
      },
      "tags": [],
      "updated_at": "2025-12-23T15:15:57.016Z"
    },
    {
      "id": "florian-strauss-28786",
      "name": "Florian Strauss",
      "alt_names": [],
      "role": "other",
      "description": "programmer",
      "metadata": {
        "positions": []
      },
      "images": [],
      "external_ids": {
        "rawg": 28786
      },
      "tags": [],
      "updated_at": "2025-12-23T15:15:57.016Z"
    },
    {
      "id": "derek-daniels-28780",
      "name": "Derek Daniels",
      "alt_names": [],
      "role": "other",
      "description": "designer",
      "metadata": {
        "positions": []
      },
      "images": [],
      "external_ids": {
        "rawg": 28780
      },
      "tags": [],
      "updated_at": "2025-12-23T15:15:57.016Z"
    },
    {
      "id": "elizabeth-dahm-wang-28782",
      "name": "Elizabeth Dahm Wang",
      "alt_names": [],
      "role": "other",
      "description": "producer",
      "metadata": {
        "positions": []
      },
      "images": [],
      "external_ids": {
        "rawg": 28782
      },
      "tags": [],
      "updated_at": "2025-12-23T15:15:57.016Z"
    },
    {
      "id": "sean-llewellyn-28783",
      "name": "Sean Llewellyn",
      "alt_names": [],
      "role": "other",
      "description": "producer",
      "metadata": {
        "positions": []
      },
      "images": [],
      "external_ids": {
        "rawg": 28783
      },
      "tags": [],
      "updated_at": "2025-12-23T15:15:57.016Z"
    },
    {
      "id": "eric-fong-28785",
      "name": "Eric Fong",
      "alt_names": [],
      "role": "other",
      "description": "producer",
      "metadata": {
        "positions": []
      },
      "images": [],
      "external_ids": {
        "rawg": 28785
      },
      "tags": [],
      "updated_at": "2025-12-23T15:15:57.016Z"
    }
  ],
  "updated_at": "2025-12-23T15:15:57.016Z"
}