{
  "work_id": "please-go-home-miss-akutsu",
  "count": 9,
  "characters": [
    {
      "id": "kouta-ooyama",
      "name": "Kouta Ooyama",
      "alt_names": [
        "大山 こうた"
      ],
      "role": "protagonist",
      "description": "Ooyama is a second-year high school student who lives alone, but has to deal with Akutsu since she is constantly hanging out in his room after school and sometimes even stays the night. While he does want Akutsu to go home, he becomes flustered when he is around her. He is also concerned that she might stay at some other guy's place if she leaves",
      "metadata": {
        "gender": "male",
        "age": "16-17",
        "dateOfBirth": null
      },
      "images": [
        {
          "url": "https://s4.anilist.co/file/anilistcdn/character/large/b193837-EdsF0gwVFc5Z.jpg",
          "type": "portrait",
          "source": "AniList"
        }
      ],
      "external_ids": {
        "anilist": 193837
      }
    },
    {
      "id": "riko-akutsu",
      "name": "Riko Akutsu",
      "alt_names": [
        "阿久津リコ"
      ],
      "role": "protagonist",
      "description": "Akutsu is Ooyama's delinquent classmate who constantly hangs out in his room to read manga, play video games, and eat snacks.\n\n~!While she likes to tease Ooyama, she slowly develops romantic feelings towards him, especially after Ooyama makes statements like pleading her to stay and not wanting her to go off with any other guys.!~",
      "metadata": {
        "gender": "female",
        "age": "16",
        "dateOfBirth": null
      },
      "images": [
        {
          "url": "https://s4.anilist.co/file/anilistcdn/character/large/b193838-Weu4PViDnJlr.jpg",
          "type": "portrait",
          "source": "AniList"
        }
      ],
      "external_ids": {
        "anilist": 193838
      }
    },
    {
      "id": "riko",
      "name": "Riko",
      "alt_names": [
        "りこ"
      ],
      "role": "supporting",
      "description": "A cat whose owner is Ooyama's landlady.",
      "metadata": {
        "gender": "female",
        "dateOfBirth": null
      },
      "images": [
        {
          "url": "https://s4.anilist.co/file/anilistcdn/character/large/b245294-rIfTtCuuUhyo.png",
          "type": "portrait",
          "source": "AniList"
        }
      ],
      "external_ids": {
        "anilist": 245294
      }
    },
    {
      "id": "aoi-ooya",
      "name": "Aoi Ooya",
      "alt_names": [
        "大矢葵"
      ],
      "role": "supporting",
      "description": "Ooya is the landlady's 20-year-old daughter.\n\n~!As a fan of romantic comedy manga, she becomes very interested in Ooyama and Akutsu's relationship when she realizes Akutsu is secretly in love with Ooyama but shyly denies it.!~",
      "metadata": {
        "gender": "female",
        "age": "20",
        "dateOfBirth": null
      },
      "images": [
        {
          "url": "https://s4.anilist.co/file/anilistcdn/character/large/b245296-LepTlva1T7UL.png",
          "type": "portrait",
          "source": "AniList"
        }
      ],
      "external_ids": {
        "anilist": 245296
      }
    },
    {
      "id": "hibiki",
      "name": "Hibiki",
      "alt_names": [
        "ヒビキ"
      ],
      "role": "supporting",
      "description": "Hibiki is a year younger than Ooyama and Akutsu. She is a delinquent who initially tried to challenge Akutsu, but lost. Since then, she has looked up to Akutsu as a big sister and demands that Ooyama give Akutsu back to her. She and Akutsu used to hang out together in the same room.",
      "metadata": {
        "gender": "female",
        "dateOfBirth": null
      },
      "images": [
        {
          "url": "https://s4.anilist.co/file/anilistcdn/character/large/b286554-uoc3TUP622NU.png",
          "type": "portrait",
          "source": "AniList"
        }
      ],
      "external_ids": {
        "anilist": 286554
      }
    },
    {
      "id": "youko-suzuki",
      "name": "Youko Suzuki",
      "alt_names": [
        "鈴木ヨウコ"
      ],
      "role": "supporting",
      "description": "Youko is one of Akutsu's friends since middle school. She has short brown hair in a ponytail and a large chest.\n\n~!Knowing that Akutsu has feelings for Ooyama, she likes to flirt with Ooyama in order to get a reaction out of Akutsu.!~",
      "metadata": {
        "gender": "female",
        "dateOfBirth": null
      },
      "images": [
        {
          "url": "https://s4.anilist.co/file/anilistcdn/character/large/b286555-XdyhPMXl9n5L.png",
          "type": "portrait",
          "source": "AniList"
        }
      ],
      "external_ids": {
        "anilist": 286555
      }
    },
    {
      "id": "misaki-tanaka",
      "name": "Misaki Tanaka",
      "alt_names": [
        "田中ミサキ"
      ],
      "role": "supporting",
      "description": "Misaki is one of Akutsu's friends since middle school. She is the shortest of the three girls and has short black hair with bunches.\n\n~!Knowing that Akutsu has feelings for Ooyama, she likes to tease her about the situation.!~",
      "metadata": {
        "gender": "female",
        "dateOfBirth": null
      },
      "images": [
        {
          "url": "https://s4.anilist.co/file/anilistcdn/character/large/b286556-nkg6lcjLkiR1.png",
          "type": "portrait",
          "source": "AniList"
        }
      ],
      "external_ids": {
        "anilist": 286556
      }
    },
    {
      "id": "reiko-akutsu",
      "name": "Reiko Akutsu",
      "alt_names": [
        "阿久津レイコ"
      ],
      "role": "supporting",
      "description": "Mother of Riko Akutsu, and a former gyaru. She and her husband are always flirting and acting lovey-dovey at home, which results in her daughter not wanting to stay there and staying at other homes, especially Ooyama's.\n\n~!She was a delinquent herself, as she also hung out often in her future husband's room, and she behaves very much like her daughter.!~",
      "metadata": {
        "gender": "female",
        "dateOfBirth": null
      },
      "images": [
        {
          "url": "https://s4.anilist.co/file/anilistcdn/character/large/b286557-APr3hYI6CvF8.jpg",
          "type": "portrait",
          "source": "AniList"
        }
      ],
      "external_ids": {
        "anilist": 286557
      }
    },
    {
      "id": "haha-ooyama",
      "name": "Haha Ooyama",
      "alt_names": [
        "大山母",
        "Mama Ooyama"
      ],
      "role": "supporting",
      "description": "Ooyama's mother is a kind woman who shows up at her son's apartment. She was initially skeptical of Akutsu until she is convinced that Akutsu and her son are dating.",
      "metadata": {
        "gender": "female",
        "dateOfBirth": null
      },
      "images": [
        {
          "url": "https://s4.anilist.co/file/anilistcdn/character/large/b286558-rPepO3pKmcCU.png",
          "type": "portrait",
          "source": "AniList"
        }
      ],
      "external_ids": {
        "anilist": 286558
      }
    }
  ],
  "updated_at": "2025-12-26T06:16:18.048Z"
}