{
  "work_id": "sss-class-revival-hunter",
  "count": 15,
  "characters": [
    {
      "id": "gong-ja-kim",
      "name": "Gong-Ja Kim",
      "alt_names": [
        "김공자",
        "Zombie",
        "The King Of Death"
      ],
      "role": "protagonist",
      "description": "Gong-Ja Kim is an aspiring hunter who is jealous of the #1 ranker: the Flame Emperor. \n\nBefore entering the tower, Gong-Ja lived his life as an orphan. Even after entering, he was a below-average hunter who adored and worshipped higher rankers. This admiration later turned into envy though, and Soo-Ha Yoo became the main subject of Gong-Ja's jealousy. This below-average hunter's life changed when he received an S-Rank Skill Card for the toxic envy he developed. His gifted S-Rank Skill Card allowed him to receive the power of those who killed him.",
      "metadata": {
        "gender": "male",
        "age": "21-",
        "dateOfBirth": null
      },
      "images": [
        {
          "url": "https://s4.anilist.co/file/anilistcdn/character/large/b203172-oVJDo9hlWshz.png",
          "type": "portrait",
          "source": "AniList"
        }
      ],
      "external_ids": {
        "anilist": 203172
      }
    },
    {
      "id": "geom-je",
      "name": "Geom-Je",
      "alt_names": [
        "검제",
        "劍帝",
        "Sword Emperor"
      ],
      "role": "protagonist",
      "description": "",
      "metadata": {
        "dateOfBirth": null
      },
      "images": [
        {
          "url": "https://s4.anilist.co/file/anilistcdn/character/large/b211827-jOlKLA5D7TWk.png",
          "type": "portrait",
          "source": "AniList"
        }
      ],
      "external_ids": {
        "anilist": 211827
      }
    },
    {
      "id": "raviel-ivansia",
      "name": "Raviel Ivansia",
      "alt_names": [
        "라비엘 이반시아",
        "Lady Silverlily"
      ],
      "role": "supporting",
      "description": "She is the villainess of the story named \"The Tale of Sormwyn Academy\".",
      "metadata": {
        "gender": "female",
        "dateOfBirth": null
      },
      "images": [
        {
          "url": "https://s4.anilist.co/file/anilistcdn/character/large/b307960-AJZpFVvSpOfK.jpg",
          "type": "portrait",
          "source": "AniList"
        }
      ],
      "external_ids": {
        "anilist": 307960
      }
    },
    {
      "id": "anastasia-zelenska",
      "name": "Anastasia Zelenska",
      "alt_names": [
        "아나스타샤 젤렌스카",
        "흑색마녀 (Heuksaengmanyeo)",
        "Black Witch"
      ],
      "role": "supporting",
      "description": "Anastasia is the Guild Leader of Black Dragon.",
      "metadata": {
        "gender": "female",
        "dateOfBirth": null
      },
      "images": [
        {
          "url": "https://s4.anilist.co/file/anilistcdn/character/large/b211824-wjpyFkQU64BZ.png",
          "type": "portrait",
          "source": "AniList"
        }
      ],
      "external_ids": {
        "anilist": 211824
      }
    },
    {
      "id": "marcus-calenbury",
      "name": "Marcus Calenbury",
      "alt_names": [
        "마르쿠스 칼렌베리",
        "검성 (Geomseong)"
      ],
      "role": "supporting",
      "description": "~! \nSword Saint \n!~",
      "metadata": {
        "dateOfBirth": null
      },
      "images": [
        {
          "url": "https://s4.anilist.co/file/anilistcdn/character/large/b211834-YdAFAIsB3P0J.png",
          "type": "portrait",
          "source": "AniList"
        }
      ],
      "external_ids": {
        "anilist": 211834
      }
    },
    {
      "id": "yakjesa",
      "name": "Yakjesa",
      "alt_names": [
        "약제사",
        "Master Alchemist"
      ],
      "role": "supporting",
      "description": "",
      "metadata": {
        "gender": "female",
        "dateOfBirth": null
      },
      "images": [
        {
          "url": "https://s4.anilist.co/file/anilistcdn/character/large/b211832-A97esdFD53Gb.png",
          "type": "portrait",
          "source": "AniList"
        }
      ],
      "external_ids": {
        "anilist": 211832
      }
    },
    {
      "id": "nisha",
      "name": "Nisha",
      "alt_names": [
        "니샤",
        "백작 (Baekjak)",
        "Countess"
      ],
      "role": "supporting",
      "description": "Nisha is the Guild Leader of the United Merchants.",
      "metadata": {
        "gender": "female",
        "dateOfBirth": null
      },
      "images": [
        {
          "url": "https://s4.anilist.co/file/anilistcdn/character/large/b211826-phKIdEVwY2eV.png",
          "type": "portrait",
          "source": "AniList"
        }
      ],
      "external_ids": {
        "anilist": 211826
      }
    },
    {
      "id": "liaofan",
      "name": "Liaofan",
      "alt_names": [
        "랴오판",
        "독사 (Doksa)",
        "Viper"
      ],
      "role": "supporting",
      "description": "Liaofan is the Guild Leader of the Heavenly Order.",
      "metadata": {
        "gender": "male",
        "dateOfBirth": null
      },
      "images": [
        {
          "url": "https://s4.anilist.co/file/anilistcdn/character/large/b211828-K4XyXooqxzj0.png",
          "type": "portrait",
          "source": "AniList"
        }
      ],
      "external_ids": {
        "anilist": 211828
      }
    },
    {
      "id": "bambollina",
      "name": "Bambollina",
      "alt_names": [
        "밤볼리나",
        "이단심문관 (Idansimmungwan)",
        "Heresy Inquisitor"
      ],
      "role": "supporting",
      "description": "Bambollina is the Guild Leader of Pantheon.",
      "metadata": {
        "gender": "male",
        "dateOfBirth": null
      },
      "images": [
        {
          "url": "https://s4.anilist.co/file/anilistcdn/character/large/b211830-NVvMIlnQFMcP.png",
          "type": "portrait",
          "source": "AniList"
        }
      ],
      "external_ids": {
        "anilist": 211830
      }
    },
    {
      "id": "patricia",
      "name": "Patricia",
      "alt_names": [
        "파트리시아",
        "성기사 (Seonggisa)",
        "Paladin"
      ],
      "role": "supporting",
      "description": "Patricia is the Guild Leader of City Security.",
      "metadata": {
        "gender": "female",
        "dateOfBirth": null
      },
      "images": [
        {
          "url": "https://s4.anilist.co/file/anilistcdn/character/large/b211831-ClCvSh43Rcb4.png",
          "type": "portrait",
          "source": "AniList"
        }
      ],
      "external_ids": {
        "anilist": 211831
      }
    },
    {
      "id": "baek-hyang-seo",
      "name": "Baek-Hyang Seo",
      "alt_names": [
        "서백향",
        "Heavenly Demon (Cheon Ma)"
      ],
      "role": "supporting",
      "description": "The leader of the Demonic Faction from the story chosen for Floor 22.",
      "metadata": {
        "gender": "female",
        "dateOfBirth": null
      },
      "images": [
        {
          "url": "https://s4.anilist.co/file/anilistcdn/character/large/b270808-miPW1dsDuvEV.png",
          "type": "portrait",
          "source": "AniList"
        }
      ],
      "external_ids": {
        "anilist": 270808
      }
    },
    {
      "id": "hamustra",
      "name": "Hamustra",
      "alt_names": [
        "하무스트라",
        "■■■■■",
        "Corner Librarian",
        "The Pond of Accumulating Memories"
      ],
      "role": "supporting",
      "description": "Hamustra is the constellation who manages from tower's 21st floor until 30th floor.",
      "metadata": {
        "gender": "male",
        "age": "1000+",
        "dateOfBirth": null
      },
      "images": [
        {
          "url": "https://s4.anilist.co/file/anilistcdn/character/large/b308932-rdY0MYAi7AZ1.jpg",
          "type": "portrait",
          "source": "AniList"
        }
      ],
      "external_ids": {
        "anilist": 308932
      }
    },
    {
      "id": "so-ha-yu",
      "name": "So-Ha Yu",
      "alt_names": [
        "유소하",
        "Soo-Ha Yoo",
        "Flame Emperor"
      ],
      "role": "supporting",
      "description": "",
      "metadata": {
        "dateOfBirth": null
      },
      "images": [
        {
          "url": "https://s4.anilist.co/file/anilistcdn/character/large/b211825-x6y6Hh8STBRJ.png",
          "type": "portrait",
          "source": "AniList"
        }
      ],
      "external_ids": {
        "anilist": 211825
      }
    },
    {
      "id": "sarbast-aegim",
      "name": "Sarbast Aegim",
      "alt_names": [],
      "role": "supporting",
      "description": "Sarbast Aegim is a NPC of SSS-geup Jugeoya Saneun Hunter.",
      "metadata": {
        "gender": "male",
        "dateOfBirth": null
      },
      "images": [
        {
          "url": "https://s4.anilist.co/file/anilistcdn/character/large/b308933-ZcHkPjNZE8wW.jpg",
          "type": "portrait",
          "source": "AniList"
        }
      ],
      "external_ids": {
        "anilist": 308933
      }
    },
    {
      "id": "preta",
      "name": "Preta",
      "alt_names": [
        "프레타",
        "The Demon King of Fall Rain",
        "Ester",
        "Saintess of the Outskirts"
      ],
      "role": "supporting",
      "description": "Preta also known as The Demon King of Fall Rain was the enemy boss of Tower's 20th floor.",
      "metadata": {
        "gender": "female",
        "dateOfBirth": null
      },
      "images": [
        {
          "url": "https://s4.anilist.co/file/anilistcdn/character/large/b308934-yGivhYmFGD0o.jpg",
          "type": "portrait",
          "source": "AniList"
        }
      ],
      "external_ids": {
        "anilist": 308934
      }
    }
  ],
  "updated_at": "2025-12-24T13:55:30.174Z"
}